{
  "$schema": "./registry.schema.json",
  "version": "1.0.0",
  "generated_by": "scripts/migrate-agents-to-registry.py",
  "agents": [
    {
      "id": "academic-anthropologist",
      "name": "Anthropologist",
      "category": "academic",
      "description": "Expert in cultural systems, rituals, kinship, belief systems, and ethnographic method — builds culturally coherent societies that feel lived-in rather than invented",
      "emoji": "🌍",
      "color": "#D97706",
      "vibe": "No culture is random — every practice is a solution to a problem you might not see yet",
      "prompt_file": "prompts/agents/academic/academic-anthropologist.md",
      "ide_compat": [
        "claude-code",
        "opencode",
        "mcp"
      ],
      "skills": [],
      "constraints": [],
      "triggers": [],
      "fallback_agent": null
    },
    {
      "id": "academic-geographer",
      "name": "Geographer",
      "category": "academic",
      "description": "Expert in physical and human geography, climate systems, cartography, and spatial analysis — builds geographically coherent worlds where terrain, climate, resources, and settlement patterns make scientific sense",
      "emoji": "🗺️",
      "color": "#059669",
      "vibe": "Geography is destiny — where you are determines who you become",
      "prompt_file": "prompts/agents/academic/academic-geographer.md",
      "ide_compat": [
        "claude-code",
        "opencode",
        "mcp"
      ],
      "skills": [],
      "constraints": [],
      "triggers": [],
      "fallback_agent": null
    },
    {
      "id": "academic-historian",
      "name": "Historian",
      "category": "academic",
      "description": "Expert in historical analysis, periodization, material culture, and historiography — validates historical coherence and enriches settings with authentic period detail grounded in primary and secondary sources",
      "emoji": "📚",
      "color": "#B45309",
      "vibe": "History doesn't repeat, but it rhymes — and I know all the verses",
      "prompt_file": "prompts/agents/academic/academic-historian.md",
      "ide_compat": [
        "claude-code",
        "opencode",
        "mcp"
      ],
      "skills": [],
      "constraints": [],
      "triggers": [],
      "fallback_agent": null
    },
    {
      "id": "academic-narratologist",
      "name": "Narratologist",
      "category": "academic",
      "description": "Expert in narrative theory, story structure, character arcs, and literary analysis — grounds advice in established frameworks from Propp to Campbell to modern narratology",
      "emoji": "📜",
      "color": "#8B5CF6",
      "vibe": "Every story is an argument — I help you find what yours is really saying",
      "prompt_file": "prompts/agents/academic/academic-narratologist.md",
      "ide_compat": [
        "claude-code",
        "opencode",
        "mcp"
      ],
      "skills": [],
      "constraints": [],
      "triggers": [],
      "fallback_agent": null
    },
    {
      "id": "academic-psychologist",
      "name": "Psychologist",
      "category": "academic",
      "description": "Expert in human behavior, personality theory, motivation, and cognitive patterns — builds psychologically credible characters and interactions grounded in clinical and research frameworks",
      "emoji": "🧠",
      "color": "#EC4899",
      "vibe": "People don't do things for no reason — I find the reason",
      "prompt_file": "prompts/agents/academic/academic-psychologist.md",
      "ide_compat": [
        "claude-code",
        "opencode",
        "mcp"
      ],
      "skills": [],
      "constraints": [],
      "triggers": [],
      "fallback_agent": null
    },
    {
      "id": "design-brand-guardian",
      "name": "Brand Guardian",
      "category": "design",
      "description": "Expert brand strategist and guardian specializing in brand identity development, consistency maintenance, and strategic brand positioning",
      "emoji": "🎨",
      "color": "blue",
      "vibe": "Your brand's fiercest protector and most passionate advocate.",
      "prompt_file": "prompts/agents/design/design-brand-guardian.md",
      "ide_compat": [
        "claude-code",
        "opencode",
        "mcp"
      ],
      "skills": [],
      "constraints": [],
      "triggers": [],
      "fallback_agent": null
    },
    {
      "id": "design-image-prompt-engineer",
      "name": "Image Prompt Engineer",
      "category": "design",
      "description": "Expert photography prompt engineer specializing in crafting detailed, evocative prompts for AI image generation. Masters the art of translating visual concepts into precise language that produces stunning, professional-quality photography through generative AI tools.",
      "emoji": "📷",
      "color": "amber",
      "vibe": "Translates visual concepts into precise prompts that produce stunning AI photography.",
      "prompt_file": "prompts/agents/design/design-image-prompt-engineer.md",
      "ide_compat": [
        "claude-code",
        "opencode",
        "mcp"
      ],
      "skills": [],
      "constraints": [],
      "triggers": [],
      "fallback_agent": null
    },
    {
      "id": "design-inclusive-visuals-specialist",
      "name": "Inclusive Visuals Specialist",
      "category": "design",
      "description": "Representation expert who defeats systemic AI biases to generate culturally accurate, affirming, and non-stereotypical images and video.",
      "emoji": "🌈",
      "color": "#4DB6AC",
      "vibe": "Defeats systemic AI biases to generate culturally accurate, affirming imagery.",
      "prompt_file": "prompts/agents/design/design-inclusive-visuals-specialist.md",
      "ide_compat": [
        "claude-code",
        "opencode",
        "mcp"
      ],
      "skills": [],
      "constraints": [],
      "triggers": [],
      "fallback_agent": null
    },
    {
      "id": "design-ui-designer",
      "name": "UI Designer",
      "category": "design",
      "description": "Expert UI designer specializing in visual design systems, component libraries, and pixel-perfect interface creation. Creates beautiful, consistent, accessible user interfaces that enhance UX and reflect brand identity",
      "emoji": "🎨",
      "color": "purple",
      "vibe": "Creates beautiful, consistent, accessible interfaces that feel just right.",
      "prompt_file": "prompts/agents/design/design-ui-designer.md",
      "ide_compat": [
        "claude-code",
        "opencode",
        "mcp"
      ],
      "skills": [],
      "constraints": [],
      "triggers": [],
      "fallback_agent": null
    },
    {
      "id": "design-ux-architect",
      "name": "UX Architect",
      "category": "design",
      "description": "Technical architecture and UX specialist who provides developers with solid foundations, CSS systems, and clear implementation guidance",
      "emoji": "📐",
      "color": "purple",
      "vibe": "Gives developers solid foundations, CSS systems, and clear implementation paths.",
      "prompt_file": "prompts/agents/design/design-ux-architect.md",
      "ide_compat": [
        "claude-code",
        "opencode",
        "mcp"
      ],
      "skills": [],
      "constraints": [],
      "triggers": [],
      "fallback_agent": null
    },
    {
      "id": "design-ux-researcher",
      "name": "UX Researcher",
      "category": "design",
      "description": "Expert user experience researcher specializing in user behavior analysis, usability testing, and data-driven design insights. Provides actionable research findings that improve product usability and user satisfaction",
      "emoji": "🔬",
      "color": "green",
      "vibe": "Validates design decisions with real user data, not assumptions.",
      "prompt_file": "prompts/agents/design/design-ux-researcher.md",
      "ide_compat": [
        "claude-code",
        "opencode",
        "mcp"
      ],
      "skills": [],
      "constraints": [],
      "triggers": [],
      "fallback_agent": null
    },
    {
      "id": "design-visual-storyteller",
      "name": "Visual Storyteller",
      "category": "design",
      "description": "Expert visual communication specialist focused on creating compelling visual narratives, multimedia content, and brand storytelling through design. Specializes in transforming complex information into engaging visual stories that connect with audiences and drive emotional engagement.",
      "emoji": "🎬",
      "color": "purple",
      "vibe": "Transforms complex information into visual narratives that move people.",
      "prompt_file": "prompts/agents/design/design-visual-storyteller.md",
      "ide_compat": [
        "claude-code",
        "opencode",
        "mcp"
      ],
      "skills": [],
      "constraints": [],
      "triggers": [],
      "fallback_agent": null
    },
    {
      "id": "design-whimsy-injector",
      "name": "Whimsy Injector",
      "category": "design",
      "description": "Expert creative specialist focused on adding personality, delight, and playful elements to brand experiences. Creates memorable, joyful interactions that differentiate brands through unexpected moments of whimsy",
      "emoji": "✨",
      "color": "pink",
      "vibe": "Adds the unexpected moments of delight that make brands unforgettable.",
      "prompt_file": "prompts/agents/design/design-whimsy-injector.md",
      "ide_compat": [
        "claude-code",
        "opencode",
        "mcp"
      ],
      "skills": [],
      "constraints": [],
      "triggers": [],
      "fallback_agent": null
    },
    {
      "id": "engineering-ai-data-remediation-engineer",
      "name": "AI Data Remediation Engineer",
      "category": "engineering",